Title;Rating;Header;Text;Date
1+1 (2011);+;Живи и радуйся жизни...;Отличная душевная трагикомедия.   Сюжет таков, богатый аристократ, в результате несчастного случая остался парализован и прикован к инвалидному креслу, так что ему необходим помощник. Но ему не нужно сострадание, жалость и сочуствие к себе. И только что освободившийся из тюрьмы простой и бедный парень - идеальный вариант. Они оба полны жизни и готовы к приключениям...   В основу фильма была положена реальная история французского бизнесмена и аристократа Филиппа Поццо ди Борго.   Фильм получился очень жизнерадостным и жизнеутверждающим, несмотря на ограниченность в действиях главного героя, ведь боль не отняла его разум, поэтому он не теряет чувство юмора и еще способен радоваться жизни. Ведь Жизнь - это единственная возможность получить наслаждение.   Стоит отметить отличную актерскую игру Франсуа Клюзе и комика Омара Сая, который добавил фильму обаяния и шарма, а приятная музыка настраивает на позитивный лад и дарит вам хорошее настроение.   Рекомендую к просмотру. ;2012-03-17T11:23:00
1+1 (2011);+;;Ночные улицы Парижа рассекает дорогой автомобиль, управляемый темнокожим молодым парнем. На переднем сиденье – немолодой мужчина с задумчивым лицом. Его взгляд устремлен вдаль, он погружен в свои размышления. Но на лице его легкая улыбка, а в уголках глаз играют маленькие морщинки. Темнокожий водитель смотрит на него и тоже улыбается. Звучит легкая, приятная музыка. И стираются преграды, разделяющие двух настолько непохожих друг на друга людей. И физические недостатки уже не причиняют боль.   Порой совершенно разные люди могут найти друг в друге что-то общее. Порой тот, кто раньше казался нам человеком из параллельной вселенной, оказывается ближе, чем самый родной и близкий человек. В определенных ситуациях наши различия – в социальном статусе, национальности, финансовом положении, образованности, - отходят на второй план. А главным становится неуловимое родство душ, интуитивные ощущения и эмоции. Простое человеческое общение становится важнее, чем любые заумные разговоры.   Фильм “Неприкасаемые”, или “1+1” (название, так и оставшееся для меня загадкой), не отличается, если подумать, большой оригинальностью. Подобные мотивы и сюжеты – дружбы двух разных людей под влиянием тяжелых жизненных обстоятельств, дружбы людей разного социального положения, - мы видели в кино уже не раз. Но приятная атмосфера, создаваемая режиссерами фильма, Оливье Накашем и  Эриком Толедано, а также отличная игра двух главных актеров – Франсуа Клюзе и Омара Си, делает этот фильм весьма оригинальным, свежим и интересным. Обаяние этих двух актеров – настоящее украшение картины. Фильм основан на реальных событиях, и его создателям, на мой взгляд, удалось сотворить очень жизненную, человечную, не преисполненную лишнего пафоса картину, в лучших традициях французского кинематографа. “Неприкасаемые” не представляют собой драму, а скорее приближены к жанру комедии, фильм не раз заставляет улыбнуться и даже рассмеяться.   Персонажи также получились очень жизненными и естественными – Омар Си, кажется, в принципе не играет, а живет своей ролью, а Франсуа Клюзо очень проникновенно передает душевную глубину своего персонажа и его желание преодолеть свой недостаток. Оба главных героя фильма меняются, находясь в тесном общении друг с другом, каждый из них обретает что-то новое, что-то важное, чего им не хватало раньше. Богатый аристократ Филипп в замечательном исполнении Клюзо, под влиянием своей непутевой “сиделки”- темнокожего парня из неблагополучного района Дрисса обретает интерес к настоящей жизни, выйдя из оболочки пыльных залов и отправившись на поиски ярких событий. Ну а Дрисс, в свою очередь, обретает некую стабильность – душевную и социальную, становится “взрослее” и учится многим новым для него вещам и явлениям.  Взаимное обогащение двух разных людей также сближает их, и рушатся последние невидимые барьеры между ними.   Так в чем же феномен фильма “Неприкасаемые”, прошедшего с огромным успехом не только во французском, но и в мировом прокате? Наверное, ответ на этот вопрос исключительно прост. Феномен этого фильма – в его доброте и человечности, которой так не хватает современному кино эпохи блокбастеров. Фильм рассказывает о, казалось бы, простых, но вечных вещах – о дружбе и любви к жизни, которые способны преодолеть любые преграды. ;2012-04-25T00:42:00
1+1 (2011);+;Добро;По-моему, одна из самых сложных тем, по которым можно снимать кино-это тема инвалидности. Я не говорю об инвалидности, как таковой, не о болезнях, или травмах, я имею ввиду жизнь этих людей. Был, например, великолепный «…а в душе я танцую», но еще какой-то внятный и не пошлый фильм на данную тему  я вспомнить не могу. Но сейчас он появился, и имя ему- «Неприкасаемые», или «1+1».   «Неприкасаемые» - это французский фильм режиссеров Накаша и Толедано, который стартовал в прокате в 2011-ом году( у нас в стране, правда, он запланирован лишь на конец апреля 2012-ого, но все желающие уже давно посмотрели его в сети). Фильм стал успешным в прокате, получил массу положительных отзывов, поднялся на высокие места в различных рейтингах, и в Топ-250( как американской, так и русской). Попробуем разобраться, чем очаровывает этот фильм, и почему он так притягивает к себе.   Во-первых, это фильм основанный на реальных событиях, который был снят при непосредственном участии главных героев. Кстати именно Филлип Поццо настоял на том, чтобы фильм получил комедийный уклон, он сказал: «В мире и без того полно зла и разочарования. Нужно давать людям надежду».   Во-вторых, та легкость восприятия, которую сумели добиться создатели фильма. «О серьезном, с юмором»- это то, что так привлекало в замечательном «Достучаться до небес». Ты понимаешь всю серьезность того, что происходит на экране, но на душе, в тоже время, легко и спокойно. Фильм чувствуешь, его понимаешь. Но не смотря на трагизм ситуации, при просмотре ни разу не возникает негативных эмоций. И даже возможные слезы в конце- это слезы счастья.   В-третьих, конечно, великолепная актерская игра. И Франсуа Клюзе и Омар Си для меня малоизвестные французские актеры, но их дуэт – без преувеличений, лучший дуэт 2011-ого. Их героям веришь, им сопереживаешь. С ними вместе ты проживаешь эти два часа.   Еще одним фактором успеха фильма я вижу потрясающий саундтрек и качественную операторскую работу. Музыка в фильме великолепна, а Вадпьед  так удачно подбирает кадры, так ловко играет с ракурсами, что фильм невероятно приятен для глаза.   Ну и последнее, друзья, как бы это странно не звучало, главный фактор успешности этого фильма-доброта. Да, доброта, которой пропитан буквально весь фильм, и которой так не хватает нам с вами в повседневной жизни. Самое могущественное, и в тоже время, самое недооцененное из человеческих качеств. Здесь же она повсюду, и это на подсознательном, на незримом уровне. Мы сами становимся добрее посмотрев этот фильм.  Мы не заметим этого, но обязательно когда-нибудь поймем.   9 из 10 ;2012-04-03T11:58:00
1+1 (2011);+;Друг — это выбранный нами родственник.;«Неприкасаемые» - новая, французская комедийная драма от режиссеров и сценаристов Оливье Накаш и Эрик Толедано. Мне не часто выпадает возможность посмотреть картины из репертуара французских кинематографистов, но так получается, что те фильмы, которые я все же посмотрю, они после себя оставляют только хорошие эмоции, впечатления и воспоминания. Фильм о крепкой и чисто случайной дружбе, всегда делают с фильмом и с очень эмоциональными зрителями нечто сказочное, после чего, это кино не может забиться или очень скоро вылететь из головы. То, что в Франции очень много темнокожих граждан, к этому все мы уже давно привыкли, вспомнить даже сборную франции по футболу. Лично мне, все равно, какой цвет кожи наполняет европейскую страну и тем более кто снимается в фильмах, для меня главное, чтобы люди были талантливые, как например главный герой этого фильма Омар Сай, парень, который очень хорошо выполнил свою роль простого, бедного паренька, который завязал крепкую дружбу с богатым, но в тоже время с очень больным человеком, для которого уже не существует самостоятельной жизни, и вряд ли она когда нибудь к нему вернется.   Дрисс - хороший, веселый, умный парень, который только что вышел из тюрьмы, и ищет себе роботу, чтобы скорее начать новую, свободную жизнь. Если бы я как нибудь проморгал этот момент, где говорят, что Дрисс бывший заключенный, я бы не поверил, ведь из самого начала, он мне очень понравился своим характером и чувством юмора, а юмора здесь не так уж и много. Я бы даже сказал, что Дрисс в этом фильме исполняет роль солнца, который ворвался в затуманенную и облачную жизнь Филиппа (Франсуа Клюзе), и подарил ему маленький, но все же светлый лучик надежды на то, что нужно жить на полную катушку, даже тогда, когда ты прикован к инвалидной коляске. В фильме хорошо показано, как человеческие отношения переходят из статуса роботы и принудительной опеки над человеком за деньги, к крепкой дружбе и настоящей человеческой заботы. Фильм основан на реальных событиях, и главные герои этого фильма сейчас живи и здоровы, и что самое главное, они не перестают общаться. История действительно требует внимания, и я ни чуточку не удивляюсь, что по ней сняли очень хорошее кино, которое просто не может оставить Вас быть безразличным к нему.  9 из 10 ;2012-03-03T19:45:00
1+1 (2011);+;Зацепило… Сильно зацепило!;"Принципиально не смотрел французское кино. Думал, что французы способны только на малоинтересные амуры... Но тут вижу фильм '1+1', который занимает шестое место в рейтинге (на данный момент) КиноПоиска. Естественно, решаюсь ознакомиться. Что сказать? Я в восторге. Это просто шедевр! Тем более, это кино основано на реальных событиях, что очень мне нравится. Смотреть всем!   В центре сюжета аристократ-паралитик Филипп, ставший инвалидом после того, как разбился на параплане. Он нанимает себе помощника, которого зовут Дрисс. Вскоре между ними завязывается крепкая дружба... За таким кратким сюжетом, на первый взгляд, скрываются глубокий смысл и драматичность. Филипп - несчастный человек, у которого есть деньги, дочь, слуги, но он страдает, так как у него парализовано практически всё тело. Можно понять, что до Дрисса у него были уже помощники, которые не оставались надолго. Дрисс также несчастливый человек: живёт в квартире, где помимо него обитает ещё n-ное количество детей и его мама. Изначально ему не нужна была работа - он хотел получить отказ для того, чтобы продолжить получать социальное пособие. Но наш добряк настаивает, чтобы он попробовал...   Фильм основан на реальных событиях. Такие картины я сразу уважаю. Особенно хвалю, если всё изображено достаточно правдоподобно. Так вот, я не был свидетелем тех событий, происходящих с Филиппом, не есть свидетелем их дружбы, но вот почему-то я уверен, что Франсуа Клюзе и Омар Си отлично сыграли настоящую крепкую дружбу, которая пробирает до слёз. Сами создатели отлично изобразили атмосферу вокруг Филиппа и Дрисса; прислугу Филиппа также показали с хорошей стороны - такие верные, добрые, честные и смелые люди - было даже завидно этому старику за таких друзей!   Хочется отметить, что у кино неплохая музыка. Да, именно эта мелодия, которая прозвучала в начале фильма, присутствовала до конца. Может, большинство вообще не заметили этой мелодии, но меня она очень зацепила: она прибавляла грусти. Когда она звучала, чуть не прослезился (чуть!).   Жанр фильма - не только драма, но и комедия. Кажется, что создатели хотели отвлечь нас от основного забавами Дрисса. Но лично мне кажется, что это всё наоборот прибавляло драматичности. К примеру, он танцует, потом начинают танцевать все, а Филипп сидит и улыбается так, будто вот-вот заплачет. Да и сам Дрисс веселится, а я прям чувствую, как ему грустно на самом деле. И таких моментов очень много...   Конечно же, мне понравились актёры, как вы уже поняли! Эти французы очень меня зацепили. Франсуа Клюзе отлично сыграл инвалида, у которого всегда улыбка на лице, а в душе - слёзы. Я ему поверил - его было жалко, я хотел, чтобы он наконец-то стал счастливым. Омар Си великолепно сыграл его весёлого друга, который кардинально изменил его жизнь, дал ему нечто новое, помог ему в личной жизни, заставил улыбнуться. Также понравились Анн Ле Ни, сыгравшая Ивон, и Одри Флеро, которая сыграла Магали. Они тоже заставили меня поверить в их искренность, дружбу, нравственность, любовь к Филиппу. Молодцы!  '1+1' - это фильм, который зацепил меня. Это кино, которое доказывает нам, что самое важное в жизни здоровье, дружба и любовь, а не деньги и власть. Рекомендую ценителям качественного кино, а не любителям крови и экшена. Многие увидят здесь что-то особенное, новое, прекрасное! Настоятельно советую ознакомиться с этим фильмом. Вы не пожалеете! Моя оценка  10 из 10 ";2012-04-23T21:43:00
